{
  "schema_version": 1,
  "git_sha": "fixture",
  "generated_at": "2000-01-01T00:00:00Z",
  "graph_hash": "sha256:bd4042feb394e1ee08e2dd1d7a8061687f36a1e866eba8d56bc6985cfe57a3e5",
  "nodes": [
    {
      "id": "src/main/java/com/acme/app",
      "kind": "package",
      "lang": "java",
      "files": [
        "src/main/java/com/acme/app/Main.java"
      ]
    },
    {
      "id": "src/main/java/com/acme/core",
      "kind": "package",
      "lang": "java",
      "files": [
        "src/main/java/com/acme/core/Engine.java",
        "src/main/java/com/acme/core/EngineTest.java"
      ]
    },
    {
      "id": "src/main/java/com/acme/core/model",
      "kind": "package",
      "lang": "java",
      "files": [
        "src/main/java/com/acme/core/model/Order.java"
      ]
    },
    {
      "id": "src/main/java/com/acme/shared",
      "kind": "package",
      "lang": "java",
      "files": [
        "src/main/java/com/acme/shared/A.java"
      ]
    },
    {
      "id": "src/main/java/com/acme/util",
      "kind": "package",
      "lang": "java",
      "files": [
        "src/main/java/com/acme/util/Strings.java"
      ]
    },
    {
      "id": "src/test/java/com/acme/shared",
      "kind": "package",
      "lang": "java",
      "files": [
        "src/test/java/com/acme/shared/B.java"
      ]
    }
  ],
  "edges": [
    {
      "from": "src/main/java/com/acme/app",
      "to": "src/main/java/com/acme/core",
      "kind": "imports",
      "confidence": "exact"
    },
    {
      "from": "src/main/java/com/acme/app",
      "to": "src/main/java/com/acme/core/model",
      "kind": "imports",
      "confidence": "exact"
    },
    {
      "from": "src/main/java/com/acme/app",
      "to": "src/main/java/com/acme/shared",
      "kind": "imports",
      "confidence": "approximate"
    },
    {
      "from": "src/main/java/com/acme/app",
      "to": "src/main/java/com/acme/util",
      "kind": "imports",
      "confidence": "exact"
    },
    {
      "from": "src/main/java/com/acme/app",
      "to": "src/test/java/com/acme/shared",
      "kind": "imports",
      "confidence": "approximate"
    },
    {
      "from": "src/main/java/com/acme/core",
      "to": "src/main/java/com/acme/util",
      "kind": "imports",
      "confidence": "exact"
    }
  ],
  "unresolved": [
    {
      "from": "src/main/java/com/acme/app/Main.java",
      "spec": "com.acme.core.Missing",
      "reason": "not-found"
    }
  ]
}
